{
  "contest": "CUMCM",
  "problem_id": "cumcm_2025_b",
  "benchmark_sources": [
    {
      "source": "https://www.mcm.edu.cn/html_cn/node/03c91a444e62eee81a3740fa97a461a6.html",
      "use": "official release page for 2025 CUMCM problems",
      "status": "checked"
    },
    {
      "source": "https://col.gxmzu.edu.cn/mathmod/UploadFiles/B%E9%A2%98.pdf",
      "use": "B problem statement mirror and attachment column meanings",
      "status": "checked"
    }
  ],
  "rubric_targets": [
    {
      "criterion": "traceability",
      "target": "all reported thickness values trace to tables and script output",
      "evidence": "results/result_registry.csv"
    },
    {
      "criterion": "validation",
      "target": "recover a known synthetic thickness within 0.050 um",
      "evidence": "tables/tab_q2_reliability.csv"
    }
  ],
  "question_count": 2,
  "subquestions": [
    {
      "id": "Q1",
      "task_type": "mechanism_modeling",
      "required_output": [
        "derive the single-beam interference frequency-thickness relation"
      ],
      "input_data": [
        "incident angle",
        "refractive index",
        "wavenumber"
      ],
      "decision_object": "thickness model",
      "constraints": [
        "Snell law determines transmitted angle",
        "wavenumber is in cm^-1 and thickness is reported in um"
      ],
      "validation": [
        "unit conversion check",
        "frequency formula check"
      ],
      "figures_needed": [
        "fig_q1_model_schematic.png",
        "fig_q1_result.png"
      ],
      "tables_needed": [
        "tab_q1_model_parameters.csv"
      ],
      "baseline_route": "Use the adjacent-peak spacing formula as a hand-checkable baseline.",
      "primary_route": "Fit the spectral oscillation frequency and convert it to thickness.",
      "fallback_route": "If frequency fitting fails, use cleaned peak spacing and report uncertainty.",
      "minimum_validation": [
        "formula unit check",
        "peak-spacing baseline comparison"
      ],
      "benchmark_sources": [
        "B problem statement attachment description"
      ],
      "rubric_targets": [
        "model mechanism",
        "traceability"
      ],
      "selling_points": [
        {
          "claim": "把厚度反演转化为光谱频率估计，模型结构清楚且可手算校验。",
          "evidence": "figures/fig_q1_model_schematic.png; tables/tab_q1_model_parameters.csv",
          "figure_or_table": "figures/fig_q1_model_schematic.png",
          "validation": "unit conversion and peak-spacing baseline"
        }
      ],
      "revision_status": {
        "state": "verified",
        "owner": "modeler",
        "next_action": "none"
      },
      "status": "verified"
    },
    {
      "id": "Q2",
      "task_type": "signal_inverse",
      "required_output": [
        "estimate thickness for 10 degree and 15 degree spectra",
        "compare estimates with the known synthetic truth"
      ],
      "input_data": [
        "data/raw/sic_10deg_synthetic.csv",
        "data/raw/sic_15deg_synthetic.csv"
      ],
      "decision_object": "estimated thickness",
      "constraints": [
        "absolute error must be <= 0.050 um",
        "two angle estimates should be mutually consistent"
      ],
      "validation": [
        "known-truth error",
        "angle consistency",
        "FFT baseline comparison"
      ],
      "figures_needed": [
        "fig_q2_model_schematic.png",
        "fig_q2_result.png",
        "fig_q2_validation.png"
      ],
      "tables_needed": [
        "tab_q2_thickness.csv",
        "tab_q2_reliability.csv"
      ],
      "baseline_route": "Use peak-spacing thickness as a transparent baseline.",
      "primary_route": "Use least-squares spectral-frequency fitting.",
      "fallback_route": "If fitting is unstable, average cleaned adjacent peak spacings.",
      "minimum_validation": [
        "known-truth error <= 0.050 um",
        "two-angle consistency",
        "FFT baseline comparison"
      ],
      "benchmark_sources": [
        "B problem statement attachment description"
      ],
      "rubric_targets": [
        "validation",
        "figure support",
        "result traceability"
      ],
      "selling_points": [
        {
          "claim": "合成真值回归让代码准确性可直接验算，而不是只验证脚本能运行。",
          "evidence": "tables/tab_q2_reliability.csv; figures/fig_q2_validation.png",
          "figure_or_table": "figures/fig_q2_validation.png",
          "validation": "max_abs_error_um <= 0.050"
        }
      ],
      "revision_status": {
        "state": "verified",
        "owner": "coder",
        "next_action": "rerun solve_sic_thickness.py after code changes"
      },
      "status": "verified"
    }
  ],
  "global_assumptions": [
    "The mini benchmark uses a known constant refractive index n = 2.55.",
    "The synthetic spectra follow the single-beam interference model plus small deterministic perturbation."
  ],
  "risk_points": [
    "Synthetic data do not replace official attachment solving.",
    "The result is a code-accuracy regression test, not an official contest answer."
  ],
  "revision_status": {
    "state": "verified",
    "owner": "supervisor",
    "next_action": "keep eval tolerance aligned with synthetic truth"
  }
}
